wikidata_id,name,term_start,wikidata_position,birth_date,birth_place,education,occupations,employers,party_history,awards,prev_positions
Q57661,Jean-Claude Juncker,,,1954-12-09,Redange-sur-Attert,University of Strasbourg || Lycée Michel-Rodange,lawyer || politician,,Christian Social People's Party,"Charlemagne Prize || Order of Merit of Baden-Württemberg || Order of Merit of Rhineland-Palatinate || Saarland Order of Merit || Order of Adolphe of Nassau || Steiger Award || Order of Christ || Cicero Orator Prize || Coudenhove-Kalergi Plaque || German citizenship price || Leopold Kunschak Prize || Order of Honour (Lower Austria) || National Maltese Order of Merit || European Culture Prize || Franz Josef Strauss Award || Order of Merit of the Principality of Liechtenstein || Golden Schlitzohr || Hanns Martin Schleyer Prize || Heinrich Brauns Award || Walter Hallstein Prize || Markgräfler Gutedelpreis || Medal for outstanding service to Bavaria in a united Europe || Point Alpha Prize || State Prize of North Rhine-Westphalia || Order of Stara Planina || Winfried Award || Robert Schuman Medal || Grand Officer of the Legion of Honour || Grand Cross of the Legion of Honour || Grand Cross 1st class of the Order of Merit of the Federal Republic of Germany || Great Cross with Star and Sash of the Order of Merit of the Federal Republic of Germany || Grand Cross of the Order of Vytautas the Great || Chevalier des Arts et des Lettres || Knight Grand Cross of the Order of Merit of the Italian Republic || Grand Cross of the Order of the Oak Crown || Commander of the Order of Polonia Restituta || Grand Cross of the Order of Isabella the Catholic || Dostyk Order of grade I || European handicraft prize || Grand Cross of Honor for Services to the Republic of Austria || Grand Cross of the Order of the Star of Romania || Grand Cross of the Order of Prince Henry || Grand Cross of Royal Norwegian Order of Merit || Grand Cross of the Order of Merit of the Grand Duchy of Luxembourg || Grand Cross of the Order of the Redeemer || Knight Grand Cross with Collar of the Order of Merit || Order of the Three Stars, 1st Class || Golden Duck Award || order of the Eagle of Tyrol || Order of Prince Yaroslav the Wise, 1st class || Grand Cordon of the Order of the Rising Sun || honorary doctor of the University of Athens || honorary doctorate of the University of Porto || Grand Cross of the Military Order of Christ || honorary doctor of the University of Sheffield || Prize for European Regional Integration || honorary doctor of the University of Miami || Q110801696 || honorary doctorate of Strasbourg-III University || Award ""For Freedom of Mass Media"" || The City of Athens Democracy Award",Deputy of the Chamber of Deputies of Luxembourg || President of the European Commission (2014-11-01 to 2019-11-30) || President of the Eurogroup (2005-01-01 to 2013-01-21) || Prime Minister of Luxembourg (1995-01-20 to 2013-12-04) || Deputy of the Chamber of Deputies of Luxembourg (2013-12-05 to 2014-10-27)
Q32681,Frans Timmermans,,,1961-05-06,Maastricht,Radboud University || Nancy-Université || Bernardinuscollege || University Nancy II || University of Lorraine || St. George's British International School,politician || diplomat || columnist,,Labour Party || GroenLinks,"Sovereign Military Order of Malta || Time 100 || Knight of the Order of Orange-Nassau || Knight of the Legion of Honour || Officer's Cross of the Order of Merit of the Republic of Poland || Grand Cross of the Order of Merit of the Republic of Poland || Grand Cross of the Order of the Lithuanian Grand Duke Gediminas || Commander of the Order of the Polar Star || Grand Cross of the Order of the Southern Cross || Order of the Cross of Terra Mariana, 1st Class || Commander of the National Order  of Merit || Grand Cross of the Order of Merit",Minister of Foreign Affairs (2012-11-05 to 2014-10-16) || Member of the European Parliament (2019-07-02 to 2019-07-02) || member of the House of Representatives of the Netherlands (1998-05-19 to 2007-02-21) || European Commissioner for Climate Action (2019-12-01 to 2023-08-22) || Secretary of State for Foreign Affairs (2007-02-22 to 2010-02-22) || vice-president of the European Commission (2019-12-01 to 2023-08-22) || Representative of the Parliamentary Assembly of the Council of Europe (2003-01-27 to 2007-04-16) || vice-president of the European Commission (2014-11-01 to 2019-12-01) || member of the House of Representatives of the Netherlands (2010-06-17 to 2012-11-04) || member of the House of Representatives of the Netherlands (2023-12-06 to 2025-11-11) || Representative of the Parliamentary Assembly of the Council of Europe (1998-09-21 to 2002-11-18)
Q3741557,Federica Mogherini,,,1973-06-16,Rome,Sciences Po Aix-en-Provence,politician || author,,Democratic Party || Democrats of the Left || Democratic Party of the Left || Italian Communist Youth Federation,Order of San Marino || Emperor Otto Prize || Order of Independence || Order of Honour || Dostyk Order of grade I || Decoration of Merit || Jubilee medal of 100th Anniversary of the Diplomatic Service Bodies of Azerbaijan || Order of Friendship of Kyrgyzstan,member of the Chamber of Deputies of the Italian Republic (2008-04-22 to 2013-03-14) || substitute member of the Parliamentary Assembly of the Council of Europe (2008-09-29 to 2011-11-25) || member of the Chamber of Deputies of the Italian Republic (2013-05-03 to 2014-10-30) || rector (from 2020-01-01) || Representative of the Parliamentary Assembly of the Council of Europe (2011-11-25 to 2013-06-27) || Italian Minister of Foreign Affairs (2014-02-22 to 2014-10-31) || High Representative of the Union for Foreign Affairs and Security Policy (2014-12-01 to 2019-01-01)
Q265277,Kristalina Georgieva,,,1953-08-13,Sofia,University of National and World Economy,politician || economist || chief executive officer || university teacher,Sofia University,,,UN board member || Managing Director of the International Monetary Fund (from 2019-10-01) || European Commissioner for Preparedness and Crisis Management (2010-02-09 to 2014-11-01) || European Commissioner for Financial Programming and the Budget (2014-11-01 to 2016-12-31) || acting president (2019-02-01 to 2019-04-08) || chief executive officer (2017-01-02 to 2019-01-01)
Q57638,Jyrki Katainen,,,1971-10-14,Siilinjärvi,University of Tampere,politician,,National Coalition Party,"Grand Cross of Honor for Services to the Republic of Austria || Order of the Cross of Terra Mariana, 1st Class || Grand Cross of the Order of the White Rose of Finland || Commander of the Order of the White Rose of Finland || Medal for Military Merits || Cross of Merit of the War Invalides",Prime Minister of Finland (2011-06-22 to 2014-06-24) || Deputy Prime Minister of Finland (2007-04-19 to 2011-06-22) || European Commissioner for Industry and Entrepreneurship (2014-11-01 to 2019-11-30) || European Commissioner for Economic Affairs (2014-07-18 to 2014-11-01) || Minister of Finance (2007-04-19 to 2011-06-22) || member of the Parliament of Finland (1999-03-24 to 2011-04-19) || member of the Parliament of Finland (2011-04-20 to 2014-06-30)
Q57630,Valdis Dombrovskis,,,1971-08-05,Riga,Johannes Gutenberg University Mainz || Riga Technical University || University of Latvia || University of Maryland,politician || physicist || economist,University of Latvia,Unity || New Era Party,"Order of the Three Stars, 2nd Class || Order of the Cross of Terra Mariana, 1st Class || Commander First Class of the Order of the White Rose of Finland || Order of Prince Yaroslav the Wise, 1st class || Order of Prince Yaroslav the Wise, 2nd class",deputy of Saeima || Minister of Finance (2002-11-07 to 2004-03-09) || Member of the European Parliament (2014-07-01 to 2014-10-31) || deputy of Saeima (2011-10-18 to 2011-11-03) || Member of the European Parliament (2004-07-20 to 2009-03-11) || Prime Minister of Latvia (2009-03-12 to 2014-01-22) || European Commissioner for Economic Affairs (from 2019-12-01) || deputy of Saeima (2010-11-02 to 2010-11-04) || European Commissioner for Trade (from 2020-08-26) || European Commissioner for Internal Market (2016-07-16 to 2020-10-12) || deputy of Saeima (2014-01-23 to 2014-06-05) || vice-president of the European Commission (from 2019-12-01)
Q512678,Maroš Šefčovič,,,1966-07-24,Bratislava,Comenius University || Moscow State Institute of International Relations || University of Economics in Bratislava,politician || diplomat,,Communist Party of Czechoslovakia || Direction – Social Democracy,"Grand Cross of the Order of Civil Merit || Order of Prince Yaroslav the Wise, 2nd class || Gratitude Medal","Permanent Representative of Slovakia to the European Union (2004-01-01 to 2009-01-01) || European Commissioner for Inter-Institutional Relations and Administration (from 2019-12-01) || European Commissioner for Energy (2014-11-01 to 2019-11-30) || European Commissioner for Digital Single Market (2019-07-03 to 2019-11-30) || European Commissioner for Education, Culture, Multilingualism and Youth (2009-10-01 to 2010-02-09) || European Commissioner for Inter-Institutional Relations and Administration (2010-02-09 to 2014-11-01) || European Commissioner for Health and Consumer Policy (2012-10-16 to 2012-11-28) || vice-president of the European Commission (from 2019-12-01)"
Q57640,Andrus Ansip,,,1956-10-01,Tartu,University of Tartu || Estonian University of Life Sciences || York University,businessperson || politician || entrepreneur || chemist || banker,,Communist Party of the Soviet Union || Estonian Reform Party,"Grand Cross 1st class of the Order of Merit of the Federal Republic of Germany || Order of the Three Stars, 2nd Class || Order of the National Coat of Arms, 2nd Class || Order of the White Star, 3rd Class",Prime Minister of Estonia (2011-04-05 to 2014-03-26) || Prime Minister of Estonia (2005-04-13 to 2007-04-05) || member of the Riigikogu (2014-03-26 to 2014-06-18) || Prime Minister of Estonia (2007-04-05 to 2011-04-04) || member of the Riigikogu (2007-03-27 to 2007-04-04) || Minister of Economic Affairs and Communications (2004-09-13 to 2005-04-13) || member of the Riigikogu (2003-03-22 to 2003-04-01) || Member of the European Parliament (from 2019-07-02) || mayor of Tartu (1998-09-10 to 2004-09-23) || member of the Riigikogu (2011-03-27 to 2011-04-05) || European Commissioner for Digital Single Market (2014-11-01 to 2019-07-01) || Member of the European Parliament (2014-07-01 to 2014-10-31)
Q57956,Günther Oettinger,,,1953-10-15,Stuttgart,University of Tübingen || Gymnasium Korntal-Münchingen,judge || lawyer || politician || jurist || consultant,,Christian Democratic Union,Order of Merit of Baden-Württemberg || language adulterator award || Officer's Cross of the Order of Merit of the Federal Republic of Germany || Knight Grand Cross of the Order for Merits to Lithuania,European Commissioner for Financial Programming and the Budget (2017-01-01 to 2019-11-30) || member of the Landtag of Baden-Württemberg (1984-01-01 to 2010-02-05) || European Commissioner for A Europe Fit for the Digital Age (2014-11-01 to 2017-01-01) || European Commissioner for Energy (2010-02-09 to 2014-11-01) || Minister-President of Baden-Württemberg (2005-04-21 to 2010-02-10)
Q234872,Cecilia Malmström,,,1968-05-15,Stockholm,University of Gothenburg || University of Paris 1 Pantheon-Sorbonne || Schillerska gymnasiet,politician || diplomat || political scientist || university teacher,University of Gothenburg,Liberals,honorary doctor of the University of Gothenburg,Minister for EU Affairs (2006-10-06 to 2010-01-22) || Member of the European Parliament (2004-07-20 to 2006-10-05) || European Commissioner for Trade (2014-11-01 to 2019-11-30) || European Commissioner for Home Affairs (2010-02-10 to 2014-10-31) || Member of the European Parliament (1999-07-20 to 2004-07-19)
Q6273395,Jonathan Hill,,,1958-06-17,England,Architectural Association School of Architecture || The Bartlett,architect || architectural historian,University College London || The Bartlett,,,
Q356919,Pierre Moscovici,,,1957-09-16,15th arrondissement of Paris,École nationale d'administration || Sciences Po || Lycée Condorcet,politician || economist,,Socialist Party || Revolutionary Communist League,Order of the Three Stars || Officer of the Legion of Honour || Commander of the Legion of Honour || Knight of the Legion of Honour || Knight Commander's Cross of the Order of Merit of the Federal Republic of Germany || prix de la Carpette anglaise,"regional council member || member of the general council || Member of the European Parliament (2004-07-20 to 2007-06-25) || Q23956505 (2020-06-03 to 2026-01-01) || member of the French National Assembly (2012-06-20 to 2012-07-21) || European Commissioner for Economic Affairs (2014-11-01 to 2019-12-01) || Minister of the Economy, Finances and Industry (2012-06-18 to 2014-04-02) || member of the French National Assembly (1997-06-12 to 1997-07-04) || Minister of the Economy, Finances and Industry (2012-05-15 to 2012-06-18) || Member of the European Parliament (1994-07-19 to 1997-06-05) || member of the French National Assembly (2014-05-03 to 2014-10-31) || member of the French National Assembly (2007-06-20 to 2012-06-16)"
Q270530,Marianne Thyssen,,,1956-07-24,Sint-Gillis-Waas,Katholieke Universiteit Leuven,politician,,Christian Democratic and Flemish,Robert Schuman Medal || Officer of the Order of Leopold || Grand Cross of the Civil Order of Alfonso X the Wise,"Member of the European Parliament (1999-07-20 to 2004-07-19) || Member of the European Parliament (1991-12-17 to 1994-07-18) || Member of the European Parliament (1994-07-19 to 1999-07-19) || Member of the European Parliament (2004-07-20 to 2009-07-13) || European Commissioner for Employment, Social Affairs and Inclusion (2014-11-01 to 2019-11-30) || Member of the European Parliament (2014-07-01 to 2014-10-31) || Member of the European Parliament (2009-07-14 to 2014-06-30)"
Q983664,Dimitris Avramopoulos,,,1953-06-06,Athens,Boston University || National and Kapodistrian University of Athens || Free University of Brussels,politician || diplomat,,New Democracy,Officer of the Legion of Honour || Commander's Cross of the Order of Merit of the Federal Republic of Germany || Knight of the National Order of Merit || Commander of the Cross of the Order of Merit of the Republic of Poland || Paul Harris Fellow,Minister for Foreign Affairs of Greece (2012-06-21 to 2013-06-24) || European Commissioner for Home Affairs (2014-11-01 to 2019-11-30) || Mayor of Athens (1995-01-01 to 2003-01-01) || Minister for National Defence of Greece (2011-11-11 to 2012-05-17) || member of the Hellenic Parliament (1993-01-01 to 1997-01-01) || Minister for National Defence of Greece (2013-06-25 to 2014-10-31) || Minister of Health of Greece (2006-02-15 to 2009-10-07) || member of the Hellenic Parliament (2004-01-01 to 2014-01-01) || Minister of Tourism of Greece (2004-03-18 to 2006-02-15)
Q774300,Vytenis Andriukaitis,,,1951-08-09,Kyusyur,Vilnius University,politician || Esperantist,,Social Democratic Party of Lithuania,January 13th commemorative medal || Officer of the Legion of Honour || Commander of the Order of the Lithuanian Grand Duke Gediminas || Grand Cross of the Order of Merit of Portugal || Medal of the Baltic Assembly,Member of the Seimas || European Commissioner for Health and Consumer Policy (2014-11-01 to 2019-11-30) || Member of the Seimas (1992-11-24 to 1996-11-22) || Member of the Seimas (1996-11-25 to 2000-10-18) || Minister of Health of Lithuania (2012-12-13 to 2014-07-14) || Member of the Seimas (2012-11-16 to 2014-09-15) || Member of the Seimas (2008-11-17 to 2012-11-16) || substitute member of the Parliamentary Assembly of the Council of Europe (1994-01-24 to 1995-01-30) || Member of the Seimas (2000-10-19 to 2004-07-27)
Q459196,Elżbieta Bieńkowska,,,1964-02-04,Katowice,Jagiellonian University || SGH Warsaw School of Economics || National School of Public Administration || IV High School of Stanislaw Staszic in Sosnowiec,politician || economist,European Commission || Centre for European Policy Studies || Ministry of Regional Development || Ministry of Infrastructure and Development,Civic Platform,"Kisiel Prize || Silver Lips award || Wiktory || Commander with Star of the Royal Norwegian Order of Merit || Gold Medal ""For Merit for Firefighting""",European Commissioner for Internal Market (2014-11-01 to 2019-11-30) || European Commissioner for Industry and Entrepreneurship (2014-11-01 to 2019-11-30) || Minister of Infrastructure and Development (2013-11-27 to 2014-09-22) || Minister of Regional Development (2007-11-16 to 2013-11-27) || Deputy Prime Minister of the Republic of Poland (2013-11-27 to 2014-09-22)
Q1317281,Miguel Arias Cañete,,,1950-02-24,Madrid,Complutense University of Madrid || Our Lady of Remembrance College,politician || jurist || State lawyer,University of Cádiz,People's Party || People's Alliance,Grand Cross of the Order of Charles III || Grand Cross of the Order of Civil Merit,"Member of the European Parliament (2014-07-01 to 2014-10-31) || Member of the European Parliament (1994-07-19 to 1999-07-19) || Member of the European Parliament (1986-01-01 to 1989-07-24) || Minister for Agriculture, Fisheries and Food (2000-04-28 to 2004-04-18) || Member of the Congress of Deputies (2008-03-24 to 2011-12-13) || Representative of the Parliamentary Assembly of the Council of Europe (2004-06-21 to 2012-01-23) || Q66757104 (1995-05-28 to 1999-01-01) || Q66757104 (1999-01-01 to 2000-04-27) || European Commissioner for Climate Action (2014-11-01 to 2019-11-30) || member of the Senate of Spain (2000-03-12 to 2004-01-20) || European Commissioner for Energy (2014-11-01 to 2019-11-30) || Member of the Congress of Deputies (2004-04-02 to 2008-04-01) || Minister of Agriculture, Food and Environment (2011-12-22 to 2014-04-28) || Member of the Parliament of Andalusia (1982-05-23 to 1986-06-22) || member of the Senate of Spain (1982-10-28 to 1986-04-23) || Member of the Congress of Deputies (2011-11-29 to 2014-07-01) || Member of the European Parliament (1989-07-25 to 1994-07-18) || chairman of the joint commission for the European Union (2008-06-03 to 2011-09-27)"
Q18206716,Violeta Bulc,,,1964-01-24,Ljubljana,University of Ljubljana || Golden Gate University,businessperson || politician || entrepreneur || basketball player,,Modern Centre Party,,"Minister without portfolio, competent for strategic projects and cohesion (2014-09-18 to 2014-11-19) || European Commissioner for Transport (2014-11-01 to 2019-11-30)"
Q1261388,Karmenu Vella,,,1950-06-19,Żurrieq,University of Malta || Sheffield Hallam University,architect || politician,,Labour Party,Officer of the Order of Saint-Charles,Member of the House of Representatives of Malta || European Commissioner for the Environment (2014-11-01 to 2019-11-30)
Q832221,Tibor Navracsics,,,1966-06-13,Veszprém,Eötvös Loránd University || ELTE Faculty of Law,lawyer || politician || diplomat,Eötvös Loránd University,Fidesz,Commander with Star of the Order of Merit of the Republic of Poland || Q56496635,"European Commissioner for Education, Culture, Multilingualism and Youth (2014-11-01 to 2019-11-30) || member of the National Assembly of Hungary (2014-05-06 to 2014-10-30) || member of the National Assembly of Hungary (2010-05-14 to 2014-05-05) || Minister without portfolio for Land Development and Use of EU Funds (from 2022-05-24) || Minister of Foreign Affairs of Hungary (2014-06-06 to 2014-09-22) || member of the National Assembly of Hungary (2006-05-16 to 2010-05-13) || Minister of Justice of Hungary (2010-05-29 to 2014-06-06) || member of the National Assembly of Hungary (from 2022-05-02)"
Q983508,Phil Hogan,,,1960-07-04,Kilkenny,University College Cork || St Kieran's College,politician,,Fine Gael,,"Minister of State at the Department of Finance (1994-12-20 to 1995-01-27) || Minister for Housing, Local Government and Heritage (2011-03-09 to 2014-07-11) || Teachta Dála (2011-03-09 to 2014-10-30) || European Commissioner for Trade (2019-12-01 to 2020-08-26) || senator of Ireland (1987-04-25 to 1989-06-15) || Teachta Dála (1992-12-14 to 1997-05-15) || Teachta Dála (2007-06-14 to 2011-02-01) || European Commissioner for Agriculture (2014-11-01 to 2019-11-30) || Teachta Dála (2002-06-06 to 2007-04-26) || Teachta Dála (1997-06-26 to 2002-04-25) || Teachta Dála (1989-06-29 to 1992-11-05)"
Q17266735,Christos Stylianides,,,1958-06-26,Nicosia,John F. Kennedy School of Government || Aristotle University of Thessaloniki,dentist || politician,,New Democracy || Democratic Rally,,Minister of Climate Crisis and Civil Protection of Greece (2021-09-10 to 2023-05-26) || Government Spokesman of Cyprus (2013-03-01 to 2014-04-11) || member of the House of Representatives of Cyprus (2006-06-01 to 2011-06-01) || Government Spokesman of Cyprus (1998-03-03 to 1999-03-16) || member of the House of Representatives of Cyprus (2011-06-02 to 2013-02-28) || European Commissioner for Preparedness and Crisis Management (2014-11-01 to 2019-11-30) || Member of the European Parliament (2014-07-01 to 2014-10-31) || Minister of Marine and the Aegean (2023-09-12 to 2025-03-14)
Q3443168,Neven Mimica,,,1953-10-12,Split,"Faculty of Economics and Business, University of Zagreb",politician || minister || diplomat,,Social Democratic Party of Croatia,,Minister of European Integration (2001-09-28 to 2002-07-30) || substitute member of the Parliamentary Assembly of the Council of Europe (2004-03-02 to 2005-04-25) || Minister of European Integration (2002-07-30 to 2003-12-23) || Representative of the Parliamentary Assembly of the Council of Europe (2005-04-25 to 2008-04-14) || European Commissioner for International Partnerships (2014-11-01 to 2019-11-30) || deputy prime minister (2011-12-23 to 2013-06-30) || representative in the Croatian Parliament (2003-12-22 to 2008-01-11) || representative in the Croatian Parliament (2008-01-11 to 2011-12-22) || European Commissioner for Consumer Policy (2013-07-01 to 2014-10-31)
Q78647,Johannes Hahn,,,1957-12-02,Vienna,University of Vienna || Theresianum,politician,Austrian Federal Government,Austrian People's Party,Order of Honour,member of the regional parliament of Vienna || European Commissioner for Cohesion and Reforms (2010-02-09 to 2014-11-01) || Federal Minister of Justice (2008-12-02 to 2009-01-15) || European Commissioner for Enlargement and European Neighbourhood Policy (2014-11-01 to 2019-11-30) || European Commissioner for Financial Programming and the Budget (2019-12-01 to 2024-11-30)
Q9697231,Carlos Moedas,,,1970-08-10,Beja,Harvard University || Harvard Business School || École Nationale des Ponts et Chaussées || University of Lisbon || Instituto Superior Técnico,engineer || politician || economist || banker || painter,Lisbon City Council,Social Democratic Party,Grand Officer of the Order of Prince Henry || Q136310641,"member of the Assembly of the Republic || Mayor of Lisbon (from 2021-10-18) || European Commissioner for Research, Innovation and Science (2014-11-01 to 2019-11-30)"
Q274770,Corina Crețu,,,1967-06-24,Bucharest,Bucharest University of Economic Studies,politician || economist || journalist,,,Order of the Star of Romania,Member of the European Parliament (2019-07-02 to 2024-07-15) || member of the Senate of Romania (2004-02-17 to 2007-12-03) || Member of the European Parliament (2014-07-01 to 2014-10-31) || member of the Chamber of Deputies of Romania (2000-01-01 to 2001-01-10) || Member of the European Parliament (2007-01-01 to 2009-07-13) || European Commissioner for Cohesion and Reforms (2014-11-01 to 2019-07-01) || Member of the European Parliament (2009-07-14 to 2014-06-30)
Q12001809,Věra Jourová,,,1964-08-18,Třebíč,"Faculty of Law, Charles University in Prague",politician || jurist || university teacher,,Social Democracy || European Democratic Party || ANO 2011,Cena města Třebíče || honorary doctor of the University of Łódź,"Minister for Regional Development (2014-01-29 to 2014-10-03) || European Commissioner for Justice, Fundamental Rights and Citizenship (2014-11-01 to 2019-11-30) || European Commissioner for Values and Transparency (from 2019-12-01) || Member of the Chamber of Deputies of the Parliament of the Czech Republic (2013-10-26 to 2014-10-21) || vice-president of the European Commission (from 2019-12-01)"
